{
  "version": 1,
  "note": "Fictional multi-seller listings for a future evaluation. Several listings may share an itemId. Prices and brands are illustrative. No detector assigned these item ids.",
  "declaredFields": ["category", "colour", "material", "silhouette", "price", "currency"],
  "listings": [
    {
      "listingId": "lst-tote-northline",
      "itemId": "item-leather-tote",
      "sellerId": "seller-northline",
      "sellerName": "Northline",
      "name": "Structured Work Tote",
      "category": "Handbags",
      "colour": "black",
      "material": "leather",
      "silhouette": "structured",
      "styles": ["structured", "classic"],
      "price": 12400,
      "currency": "INR",
      "description": "Firm-sided black leather tote for a laptop and a workday commute."
    },
    {
      "listingId": "lst-tote-second",
      "itemId": "item-leather-tote",
      "sellerId": "seller-second-stitch",
      "sellerName": "Second Stitch",
      "name": "Structured Work Tote",
      "category": "Handbags",
      "colour": "black",
      "material": "leather",
      "silhouette": "structured",
      "styles": ["structured", "classic"],
      "price": 12400,
      "currency": "INR",
      "description": "The same fictional black leather work tote, offered by a second seller."
    },
    {
      "listingId": "lst-tote-mislabel",
      "itemId": "item-leather-tote",
      "sellerId": "seller-mislabel",
      "sellerName": "Mislabel Mart",
      "name": "Structured Work Tote",
      "category": "Handbags",
      "colour": "black",
      "material": "canvas",
      "silhouette": "structured",
      "styles": ["structured", "classic"],
      "price": 5400,
      "currency": "INR",
      "description": "Claims the same work tote, but states canvas and a lower price."
    },
    {
      "listingId": "lst-canvas-kite",
      "itemId": "item-canvas-tote",
      "sellerId": "seller-kite",
      "sellerName": "Kite & Co",
      "name": "Structured Canvas Tote",
      "category": "Handbags",
      "colour": "black",
      "material": "canvas",
      "silhouette": "structured",
      "styles": ["structured", "classic"],
      "price": 5400,
      "currency": "INR",
      "description": "A different item: a boxed canvas tote with a commute shape and a lighter shell."
    },
    {
      "listingId": "lst-shoulder-harbour",
      "itemId": "item-soft-shoulder",
      "sellerId": "seller-harbour",
      "sellerName": "Harbour Lane",
      "name": "Soft Shoulder Bag",
      "category": "Handbags",
      "colour": "brown",
      "material": "leather",
      "silhouette": "shoulder",
      "styles": ["minimalist"],
      "price": 8600,
      "currency": "INR",
      "description": "An unlined brown leather shoulder bag. A different item from the work tote."
    },
    {
      "listingId": "lst-loafer-field",
      "itemId": "item-black-loafer",
      "sellerId": "seller-field",
      "sellerName": "Field & Form",
      "name": "Black Leather Loafer",
      "category": "Flats and loafers",
      "colour": "black",
      "material": "leather",
      "silhouette": "loafer",
      "styles": ["classic"],
      "price": 7800,
      "currency": "INR",
      "description": "A black leather loafer with a low heel."
    },
    {
      "listingId": "lst-loafer-resale",
      "itemId": "item-black-loafer",
      "sellerId": "seller-resale",
      "sellerName": "Resale Row",
      "name": "Black Leather Loafer",
      "category": "Flats and loafers",
      "colour": "black",
      "material": "leather",
      "silhouette": "loafer",
      "styles": ["classic"],
      "price": 7800,
      "currency": "INR",
      "description": "The same fictional black leather loafer, listed again at the same stated price."
    },
    {
      "listingId": "lst-loafer-suede",
      "itemId": "item-black-loafer",
      "sellerId": "seller-mislabel",
      "sellerName": "Mislabel Mart",
      "name": "Black Loafer",
      "category": "Flats and loafers",
      "colour": "black",
      "material": "suede",
      "silhouette": "loafer",
      "styles": ["classic"],
      "price": 6400,
      "currency": "INR",
      "description": "Claims the same loafer, but states suede and a different price."
    },
    {
      "listingId": "lst-loafer-brown",
      "itemId": "item-brown-loafer",
      "sellerId": "seller-harbour",
      "sellerName": "Harbour Lane",
      "name": "Brown Leather Loafer",
      "category": "Flats and loafers",
      "colour": "brown",
      "material": "leather",
      "silhouette": "loafer",
      "styles": ["classic"],
      "price": 7600,
      "currency": "INR",
      "description": "A brown leather loafer. A different item from the black loafer."
    },
    {
      "listingId": "lst-oxford-loom",
      "itemId": "item-weekday-oxford",
      "sellerId": "seller-loom",
      "sellerName": "Loom & Co",
      "name": "Weekday Oxford Shirt",
      "category": "Tops",
      "colour": "white",
      "material": "cotton",
      "silhouette": "shirt",
      "styles": ["minimalist"],
      "price": 2800,
      "currency": "INR",
      "description": "A white cotton oxford shirt for everyday wear."
    },
    {
      "listingId": "lst-oxford-resale",
      "itemId": "item-weekday-oxford",
      "sellerId": "seller-resale",
      "sellerName": "Resale Row",
      "name": "Weekday Oxford Shirt",
      "category": "Tops",
      "colour": "white",
      "material": "cotton",
      "silhouette": "shirt",
      "styles": ["minimalist"],
      "price": 2800,
      "currency": "INR",
      "description": "The same fictional white cotton shirt, offered by a second seller."
    },
    {
      "listingId": "lst-oxford-price",
      "itemId": "item-weekday-oxford",
      "sellerId": "seller-market",
      "sellerName": "Market Stall",
      "name": "Weekday Oxford Shirt",
      "category": "Tops",
      "colour": "white",
      "material": "cotton",
      "silhouette": "shirt",
      "styles": ["minimalist"],
      "price": 4100,
      "currency": "INR",
      "description": "Claims the same shirt and the same cotton, at a different stated price."
    },
    {
      "listingId": "lst-clutch-mira",
      "itemId": "item-evening-clutch",
      "sellerId": "seller-mira",
      "sellerName": "Atelier Mira",
      "name": "Evening Clutch",
      "category": "Handbags",
      "colour": "burgundy",
      "material": "silk",
      "silhouette": "clutch",
      "styles": ["artistic"],
      "price": 9900,
      "currency": "INR",
      "description": "A framed burgundy silk clutch for evening."
    },
    {
      "listingId": "lst-clutch-resale",
      "itemId": "item-evening-clutch",
      "sellerId": "seller-resale",
      "sellerName": "Resale Row",
      "name": "Evening Clutch",
      "category": "Handbags",
      "colour": "burgundy",
      "material": "silk",
      "silhouette": "clutch",
      "styles": ["artistic"],
      "price": 9900,
      "currency": "INR",
      "description": "The same fictional silk clutch, listed by a second seller."
    },
    {
      "listingId": "lst-mini-vesper",
      "itemId": "item-evening-mini",
      "sellerId": "seller-vesper",
      "sellerName": "Vesper",
      "name": "Evening Mini",
      "category": "Handbags",
      "colour": "burgundy",
      "material": "silk",
      "silhouette": "mini",
      "styles": ["artistic"],
      "price": 4500,
      "currency": "INR",
      "description": "A compact burgundy silk mini bag. A different item from the framed clutch."
    },
    {
      "listingId": "lst-sneaker-kite",
      "itemId": "item-court-sneaker",
      "sellerId": "seller-kite",
      "sellerName": "Kite & Co",
      "name": "Bold Court Sneaker",
      "category": "Sneakers",
      "colour": "white",
      "material": "synthetic",
      "silhouette": "court",
      "styles": ["bold"],
      "price": 4200,
      "currency": "INR",
      "description": "A white court sneaker with a synthetic upper."
    },
    {
      "listingId": "lst-sneaker-resale",
      "itemId": "item-court-sneaker",
      "sellerId": "seller-mislabel",
      "sellerName": "Mislabel Mart",
      "name": "Bold Court Sneaker",
      "category": "Sneakers",
      "colour": "white",
      "material": "leather",
      "silhouette": "court",
      "styles": ["bold"],
      "price": 4200,
      "currency": "INR",
      "description": "Claims the same sneaker, but states a leather upper."
    },
    {
      "listingId": "lst-coat-archive",
      "itemId": "item-wool-coat",
      "sellerId": "seller-archive",
      "sellerName": "Archive",
      "name": "Archive Wool Coat",
      "category": "Jackets and coats",
      "colour": "grey",
      "material": "wool",
      "silhouette": "coat",
      "styles": ["classic"],
      "price": 15000,
      "currency": "INR",
      "description": "A grey wool coat. A different item from the sneaker and the shirt."
    }
  ]
}
